{
  "schema_version": 1,
  "run": {
    "id": 38420515410,
    "nomor": 17,
    "repo": "MIlhamRidhoP/TA-ssdlc-devops-akademik",
    "commit": "adaa347277dd2cc0099b83eebafb83eb8048ccca",
    "branch": "feat/security-dashboard",
    "label": "sd-mv6tp2cf8c9x",
    "mulai": "2026-10-13T15:15:40Z",
    "selesai": "2026-10-13T15:17:20.659Z",
    "durasi_detik": 101,
    "mode": "sast",
    "model": null,
    "prompt_sha256": null,
    "sast": {
      "alat": "SonarCloud",
      "revisi_analisis": null,
      "sesuai_commit": null
    },
    "gemini": {
      "status": "dilewati",
      "parse_ok": null,
      "jumlah_temuan": null,
      "galat": null
    },
    "jobs": {
      "build_test": "success",
      "sonarcloud": "success",
      "analisis": "success"
    }
  },
  "findings": [],
  "sonar_verification": {
    "dikonfirmasi": 0,
    "ditolak": 0,
    "perlu_review": 0,
    "asal": "turunan-pencocokan"
  }
}
